{
  "schema_version": "1.0",
  "spec_revision": "1.0.0",
  "rfc_defaults": {
    "RFC-0001": {
      "id_prefix": "HWR-SCOPE",
      "owner": "spec-governance",
      "profiles": [
        "editorial-core",
        "editorial-visual",
        "benchmark"
      ],
      "verification_method": "manual-review"
    },
    "RFC-0002": {
      "id_prefix": "HWR-PIPE",
      "owner": "pipeline",
      "profiles": [
        "editorial-core",
        "editorial-visual",
        "benchmark"
      ],
      "verification_method": "conformance-fixture"
    },
    "RFC-0003": {
      "id_prefix": "HWR-OBJ",
      "owner": "object-model",
      "profiles": [
        "editorial-core",
        "editorial-visual",
        "benchmark"
      ],
      "verification_method": "automated-validator"
    },
    "RFC-0004": {
      "id_prefix": "HWR-RESOLVE",
      "owner": "resolver",
      "profiles": [
        "editorial-core",
        "editorial-visual",
        "benchmark"
      ],
      "verification_method": "automated-test"
    },
    "RFC-0005": {
      "id_prefix": "HWR-REVIEW",
      "owner": "review",
      "profiles": [
        "editorial-core",
        "editorial-visual",
        "benchmark"
      ],
      "verification_method": "conformance-fixture"
    },
    "RFC-0006": {
      "id_prefix": "HWR-BENCH",
      "owner": "benchmark",
      "profiles": [
        "benchmark"
      ],
      "verification_method": "benchmark-audit"
    }
  },
  "requirements": [
    {
      "id": "HWR-SCOPE-001",
      "rfc": "RFC-0001",
      "section": "Status",
      "source_text": "`Stable` means normative RFC and active object identifiers follow the compatibility policy for the 1.x line. An implementation claiming conformance with this revision MUST follow its normative requirements or disclose a permitted `SHOULD` deviation. It MUST NOT treat `MUST` requirements as optional because the implementation, adapter, or workflow is experimental.",
      "normative_terms": {
        "must": 1,
        "must_not": 1,
        "should": 0,
        "should_not": 0
      },
      "status": "planned"
    },
    {
      "id": "HWR-SCOPE-002",
      "rfc": "RFC-0001",
      "section": "Goals",
      "source_text": "A conforming implementation MUST be able to:",
      "normative_terms": {
        "must": 1,
        "must_not": 0,
        "should": 0,
        "should_not": 0
      },
      "status": "planned"
    },
    {
      "id": "HWR-SCOPE-003",
      "rfc": "RFC-0001",
      "section": "Content model",
      "source_text": "An implementation MUST keep these axes logically distinct:",
      "normative_terms": {
        "must": 1,
        "must_not": 0,
        "should": 0,
        "should_not": 0
      },
      "status": "planned"
    },
    {
      "id": "HWR-SCOPE-004",
      "rfc": "RFC-0001",
      "section": "Content model",
      "source_text": "A module MAY constrain several axes through declared applicability metadata, but it MUST NOT silently redefine another axis. For example, a platform MAY constrain length and media placement; it MUST NOT weaken a scientific evidence requirement.",
      "normative_terms": {
        "must": 0,
        "must_not": 2,
        "should": 0,
        "should_not": 0
      },
      "status": "planned"
    },
    {
      "id": "HWR-SCOPE-005",
      "rfc": "RFC-0001",
      "section": "Factual integrity",
      "source_text": "- An implementation MUST NOT invent or silently strengthen material claims.",
      "normative_terms": {
        "must": 0,
        "must_not": 1,
        "should": 0,
        "should_not": 0
      },
      "status": "planned"
    },
    {
      "id": "HWR-SCOPE-006",
      "rfc": "RFC-0001",
      "section": "Factual integrity",
      "source_text": "- An inference MUST NOT be presented as a verified fact.",
      "normative_terms": {
        "must": 0,
        "must_not": 1,
        "should": 0,
        "should_not": 0
      },
      "status": "planned"
    },
    {
      "id": "HWR-SCOPE-007",
      "rfc": "RFC-0001",
      "section": "Factual integrity",
      "source_text": "- Missing evidence MUST NOT be converted into evidence of absence.",
      "normative_terms": {
        "must": 0,
        "must_not": 1,
        "should": 0,
        "should_not": 0
      },
      "status": "planned"
    },
    {
      "id": "HWR-SCOPE-008",
      "rfc": "RFC-0001",
      "section": "Factual integrity",
      "source_text": "- Conflicting or insufficient sources MUST remain visible when they affect interpretation.",
      "normative_terms": {
        "must": 1,
        "must_not": 0,
        "should": 0,
        "should_not": 0
      },
      "status": "planned"
    },
    {
      "id": "HWR-SCOPE-009",
      "rfc": "RFC-0001",
      "section": "Legitimate perspective",
      "source_text": "- First-person experience MUST originate from authorized author material.",
      "normative_terms": {
        "must": 1,
        "must_not": 0,
        "should": 0,
        "should_not": 0
      },
      "status": "planned"
    },
    {
      "id": "HWR-SCOPE-010",
      "rfc": "RFC-0001",
      "section": "Legitimate perspective",
      "source_text": "- Expert authority MUST NOT be inferred from tone alone.",
      "normative_terms": {
        "must": 0,
        "must_not": 1,
        "should": 0,
        "should_not": 0
      },
      "status": "planned"
    },
    {
      "id": "HWR-SCOPE-011",
      "rfc": "RFC-0001",
      "section": "Legitimate perspective",
      "source_text": "- An implementation MUST NOT imitate a named living author or an identifiable private person.",
      "normative_terms": {
        "must": 0,
        "must_not": 1,
        "should": 0,
        "should_not": 0
      },
      "status": "planned"
    },
    {
      "id": "HWR-SCOPE-012",
      "rfc": "RFC-0001",
      "section": "Audience integrity",
      "source_text": "- Audience needs and intended outcome MUST be known or safely inferred before format conventions are optimized.",
      "normative_terms": {
        "must": 1,
        "must_not": 0,
        "should": 0,
        "should_not": 0
      },
      "status": "planned"
    },
    {
      "id": "HWR-SCOPE-013",
      "rfc": "RFC-0001",
      "section": "Audience integrity",
      "source_text": "- Engagement tactics MUST NOT override meaning, evidence, safety, or consent.",
      "normative_terms": {
        "must": 0,
        "must_not": 1,
        "should": 0,
        "should_not": 0
      },
      "status": "planned"
    },
    {
      "id": "HWR-SCOPE-014",
      "rfc": "RFC-0001",
      "section": "Visual integrity",
      "source_text": "- A generated image MUST NOT be presented as a photograph, screenshot, record, or other documentary evidence of a real event, person, place, product, or interface.",
      "normative_terms": {
        "must": 0,
        "must_not": 1,
        "should": 0,
        "should_not": 0
      },
      "status": "planned"
    },
    {
      "id": "HWR-SCOPE-015",
      "rfc": "RFC-0001",
      "section": "Visual integrity",
      "source_text": "- A visual MUST NOT introduce unsupported data, labels, scale, causation, anatomy, features, or historical detail.",
      "normative_terms": {
        "must": 0,
        "must_not": 1,
        "should": 0,
        "should_not": 0
      },
      "status": "planned"
    },
    {
      "id": "HWR-SCOPE-016",
      "rfc": "RFC-0001",
      "section": "Visual integrity",
      "source_text": "- Rights, likeness, privacy, accessibility, provenance, and mandatory disclosure MUST be handled as part of the artifact contract.",
      "normative_terms": {
        "must": 1,
        "must_not": 0,
        "should": 0,
        "should_not": 0
      },
      "status": "planned"
    },
    {
      "id": "HWR-SCOPE-017",
      "rfc": "RFC-0001",
      "section": "Review integrity",
      "source_text": "- A review MUST identify concrete affected content or assets.",
      "normative_terms": {
        "must": 1,
        "must_not": 0,
        "should": 0,
        "should_not": 0
      },
      "status": "planned"
    },
    {
      "id": "HWR-SCOPE-018",
      "rfc": "RFC-0001",
      "section": "Review integrity",
      "source_text": "- A revision MUST address findings rather than create unrelated stylistic churn.",
      "normative_terms": {
        "must": 1,
        "must_not": 0,
        "should": 0,
        "should_not": 0
      },
      "status": "planned"
    },
    {
      "id": "HWR-SCOPE-019",
      "rfc": "RFC-0001",
      "section": "Review integrity",
      "source_text": "- An artifact with an open blocker or major finding MUST NOT be labeled publication-ready.",
      "normative_terms": {
        "must": 0,
        "must_not": 1,
        "should": 0,
        "should_not": 0
      },
      "status": "planned"
    },
    {
      "id": "HWR-SCOPE-020",
      "rfc": "RFC-0001",
      "section": "Normative precedence",
      "source_text": "When requirements conflict, an implementation MUST apply this order:",
      "normative_terms": {
        "must": 1,
        "must_not": 0,
        "should": 0,
        "should_not": 0
      },
      "status": "planned"
    },
    {
      "id": "HWR-SCOPE-021",
      "rfc": "RFC-0001",
      "section": "Normative precedence",
      "source_text": "An explicit user preference MAY override a stylistic default or recommendation. It MUST NOT override source integrity, legitimate perspective, rights, disclosure, or a failed gate.",
      "normative_terms": {
        "must": 0,
        "must_not": 1,
        "should": 0,
        "should_not": 0
      },
      "status": "planned"
    },
    {
      "id": "HWR-SCOPE-022",
      "rfc": "RFC-0001",
      "section": "Normative precedence",